<?xml version="1.0" encoding="UTF-8" standalone="no"?><Ipar xmlns:xsi="http://www.w3.org/2001/XMLSchema-instance" xsi:noNamespaceSchemaLocation="XMLSchemaFU7OMC.xsd">
    <Gyar Gyarkod="A1">
        <Nev>SínCsináló Kft.</Nev> 
        <Cim>
            <Varos>Miskolc,</Varos>
            <Utca>Szép lány</Utca>
            <Hazszam>54</Hazszam>
        </Cim>
        <Adoszam>ABCD1234</Adoszam>
        <MuszakVezeto M_kod="M1">
            <Nev>Trombitás Elemér</Nev> 
            <Eletkor>62</Eletkor>
            <Vegzettseg>Lakatos</Vegzettseg>
        </MuszakVezeto>
        <Szakmunkas Sz_kod="SZ1">
            <Nev>Szabó Gábor</Nev> 
            <Eletkor>32</Eletkor>
            <Vegzettseg>Kisegítő</Vegzettseg>
        </Szakmunkas>
        <Szakmunkas Sz_kod="SZ2">
            <Nev>Lakatos Attila</Nev> 
            <Eletkor>48</Eletkor>
            <Vegzettseg>Hegesztő</Vegzettseg>
        </Szakmunkas>
        <Gyakornok Gy_kod="Gyak1">
            <Nev>Illés Dániel</Nev> 
            <Gyakorlat>
                <Kezdete>2024.02.14</Kezdete>
                <Idotartam>8 hét</Idotartam>
            </Gyakorlat>
            <Eletkor>20</Eletkor>
        </Gyakornok>
        <Megrendelo Mkod="M1">
            <Nev>Máv Zrt.</Nev> 
            <Cim>
                <Varos>Budapest</Varos>
                <Utca>Máv</Utca>
                <Hazszam>32</Hazszam>
            </Cim>
            <Telefonszam>+36 20 456 4353</Telefonszam>
        </Megrendelo>
        <Rendeles GyarMR="GYR1" Rkod="R1">
            <Termek>Vasúti Sín</Termek>
            <Osszeg>12,345,654 Ft</Osszeg>
            <Datum>2024.03.21.</Datum>
        </Rendeles>
    </Gyar>
    <Gyar Gyarkod="A2">
        <Nev>Lakatos Négyes Kft.</Nev> 
        <Cim>
            <Varos>Szeged,</Varos>
            <Utca>Alma</Utca>
            <Hazszam>122</Hazszam>
        </Cim>
        <Adoszam>ADEFG231</Adoszam>
        <MuszakVezeto M_kod="M2">
            <Nev>Lézer Géza</Nev> 
            <Eletkor>56</Eletkor>
            <Vegzettseg>Virágkötő</Vegzettseg>
        </MuszakVezeto>
        <Szakmunkas Sz_kod="SZ3">
            <Nev>Vad Levente</Nev> 
            <Eletkor>23</Eletkor>
            <Vegzettseg>Lakatos</Vegzettseg>
        </Szakmunkas>
        <Szakmunkas Sz_kod="SZ4">
            <Nev>Lázár Ferenc</Nev> 
            <Eletkor>28</Eletkor>
            <Vegzettseg>Lakatos</Vegzettseg>
        </Szakmunkas>
        <Gyakornok Gy_kod="Gyak2">
            <Nev>Gál Ágoston</Nev> 
            <Gyakorlat>
                <Kezdete>2024.08.04</Kezdete>
                <Idotartam>4 hét</Idotartam>
            </Gyakorlat>
            <Eletkor>23</Eletkor>
        </Gyakornok>
        <Megrendelo Mkod="M2">
            <Nev>Szabó Ábel</Nev> 
            <Cim>
                <Varos>Szeged</Varos>
                <Utca>Pillangó</Utca>
                <Hazszam>16</Hazszam>
            </Cim>
            <Telefonszam>+36 30 765 9812</Telefonszam>
        </Megrendelo>
        <Rendeles GyarMR="GYR2" Rkod="R2">
            <Termek>XXL Lakat</Termek>
            <Osszeg>378.990 Ft</Osszeg>
            <Datum>2024.07.01.</Datum>
        </Rendeles>
    </Gyar>
    <Gyar Gyarkod="A1">
        <Nev>SínCsináló Kft.</Nev> 
        <Cim>
            <Varos>Miskolc,</Varos>
            <Utca>Szép lány</Utca>
            <Hazszam>54</Hazszam>
        </Cim>
        <Adoszam>ABCD1234</Adoszam>
        <MuszakVezeto M_kod="M1">
            <Nev>Trombitás Elemér</Nev> 
            <Eletkor>62</Eletkor>
            <Vegzettseg>Lakatos</Vegzettseg>
        </MuszakVezeto>
        <Szakmunkas Sz_kod="SZ1">
            <Nev>Szabó Gábor</Nev> 
            <Eletkor>32</Eletkor>
            <Vegzettseg>Kisegítő</Vegzettseg>
        </Szakmunkas>
        <Szakmunkas Sz_kod="SZ2">
            <Nev>Lakatos Attila</Nev> 
            <Eletkor>48</Eletkor>
            <Vegzettseg>Hegesztő</Vegzettseg>
        </Szakmunkas>
        <Gyakornok Gy_kod="Gyak1">
            <Nev>Illés Dániel</Nev> 
            <Gyakorlat>
                <Kezdete>2024.02.14</Kezdete>
                <Idotartam>8 hét</Idotartam>
            </Gyakorlat>
            <Eletkor>20</Eletkor>
        </Gyakornok>
        <Megrendelo Mkod="M1">
            <Nev>Máv Zrt.</Nev> 
            <Cim>
                <Varos>Budapest</Varos>
                <Utca>Máv</Utca>
                <Hazszam>32</Hazszam>
            </Cim>
            <Telefonszam>+36 20 456 4353</Telefonszam>
        </Megrendelo>
        <Rendeles GyarMR="GYR1" Rkod="R1">
            <Termek>Vasúti Sín</Termek>
            <Osszeg>12,345,654 Ft</Osszeg>
            <Datum>2024.03.21.</Datum>
        </Rendeles>
    </Gyar>
    <Gyar Gyarkod="A3">
        <Nev>Szabó Cipő és Társa</Nev> 
        <Cim>
            <Varos>Kecskemét,</Varos>
            <Utca>Barack</Utca>
            <Hazszam>43</Hazszam>
        </Cim>
        <Adoszam>VCVES421</Adoszam>
        <MuszakVezeto M_kod="M3">
            <Nev>Sándor Barnabás</Nev> 
            <Eletkor>42</Eletkor>
            <Vegzettseg>Cipész mester</Vegzettseg>
        </MuszakVezeto>
        <Szakmunkas Sz_kod="SZ5">
            <Nev>Pál Kata</Nev> 
            <Eletkor>29</Eletkor>
            <Vegzettseg>Cipész</Vegzettseg>
        </Szakmunkas>
        <Szakmunkas Sz_kod="SZ6">
            <Nev>Albán Jóna</Nev> 
            <Eletkor>37</Eletkor>
            <Vegzettseg>Cipész</Vegzettseg>
        </Szakmunkas>
        <Gyakornok Gy_kod="Gyak3">
            <Nev>Fazekas Gergő</Nev> 
            <Gyakorlat>
                <Kezdete>2024.11.04</Kezdete>
                <Idotartam>6 hét</Idotartam>
            </Gyakorlat>
            <Eletkor>24</Eletkor>
        </Gyakornok>
        <Megrendelo Mkod="M3">
            <Nev>Álmos Elemér</Nev> 
            <Cim>
                <Varos>Miskolc</Varos>
                <Utca>Erkel Ferenc</Utca>
                <Hazszam>37</Hazszam>
            </Cim>
            <Telefonszam>+36 70 685 0832</Telefonszam>
        </Megrendelo>
        <Rendeles GyarMR="GYR3" Rkod="R3">
            <Termek>46-os Bőr bakkancs</Termek>
            <Osszeg>57.990 Ft</Osszeg>
            <Datum>2024.10.29.</Datum>
        </Rendeles>
    </Gyar>
</Ipar>