<?xml version="1.0" encoding="UTF-8" standalone="no"?><Ipar xmlns:xsi="http://www.w3.org/2001/XMLSchema-instance" xsi:noNamespaceSchemaLocation="XMLSchemaFU7OMC.xsd">
    <Gyar Gyarkod="A1">
        <Nev/> 
        <Cim>
            <Varos/>
            <Utca/>
            <Hazszam/>
        </Cim>
        <Adoszam/>
        <Muszak_Vezeto M_kod="B1">
            <Nev/> 
            <Eletkor/>
            <Vegzettseg/>
        </Muszak_Vezeto>
        <Szakmunkas Sz_kod="C1">
            <Nev/> 
            <Eletkor/>
            <Vegzettseg/>
        </Szakmunkas>
        <Gyakornok Gy_kod="D1">
            <Nev/> 
            <Gyakorlat>
                <Kezdete/>
                <Idotartam/>
            </Gyakorlat>
            <Eletkor/>
        </Gyakornok>
        <Megrendelo Mkod="E1">
            <Nev/> 
            <Cim>
                <Varos/>
                <Utca/>
                <Hazszam/>
            </Cim>
            <Telefonszam/>
        </Megrendelo>
        <Rendeles GyarMR="G1" Rkod="F1">
            <Termek/>
            <Osszeg/>
            <Datum/>
        </Rendeles>
    </Gyar>
</Ipar>